,Name,Country,Links
0,RMDLT Portel-Pará REDD Project,Brazil,https://www.allcot.com/en/portfolio/rmdlt-portel-para-redd-project/
1,Loma Los Colorados Landfill Gas Project,Chile,https://www.allcot.com/en/portfolio/loma-los-colorados-landfill-gas-project/
2,Auto-generation of renewable energy in the Cañaveralejo Wastewater Treatment Plant of EMCALI,Colombia,https://www.allcot.com/en/portfolio/4-auto-generation-of-renewable-energy-in-the-canaveralejo-wastewater-treatment-plant-of-emcali/
3,Recovery and combustion of methane Cañaveralejo Wastewater Treatment Plant of EMCALI,Colombia,https://www.allcot.com/en/portfolio/3-recovery-and-combustion-of-methane-canaveralejo-wastewater-treatment-plant-of-emcali/
4,SHP Morro Azul CDM Project (JUN1164),Colombia,https://www.allcot.com/en/portfolio/shp-morro-azul-cdm-project-jun1164/
5,Durango – EcoMethane Landfill Gas to Energy Project,Mexico,https://www.allcot.com/en/portfolio/durango-ecomethane-landfill-gas-to-energy-project/
6,Tecamac – EcoMethane Landfill Gas to Energy Project,Mexico,https://www.allcot.com/en/portfolio/tecamac_landfill_cdm_mexico/
7,Aguascalientes – EcoMethane Landfill Gas to Energy Project,Mexico,https://www.allcot.com/en/portfolio/aguascalientes_landfill_cdm_mexico/
8,Santa Marta Landfill Gas (LFG) Capture for Electricity Generation Project,Chile,https://www.allcot.com/en/portfolio/santa-marta-landfill-gas-recovery-project/
